<?xml version="1.0" encoding="UTF-8"?>
<houses xmlns:xsi="http://www.w3.org/2001/XMLSchema-instance"
    xsi:noNamespaceSchemaLocation="file:/C:/workspace/rent-a-house/houses.xsd">
    <house>
        <reference>01</reference>
        <location>
            <country>Portugal</country>
            <region>Lisboa</region>
            <city>Lisboa</city>
            <district>Benfica</district>
            <comments>Perto do Estádio da Luz</comments>
        </location>
        <situation>Center</situation>
        <condition>Good</condition>
        <type></type>
        <facilities>
            <Internet>true</Internet>
            <centralHeating>true</centralHeating>
            <cableTv>true</cableTv>
            <videoDVD>true</videoDVD>
            <refrigerator>true</refrigerator>
        </facilities>
        <personsAllowed>1</personsAllowed>
        <roomMateAllowed>false</roomMateAllowed>
        <petsAllowed>false</petsAllowed>
        <childrenAllowed>false</childrenAllowed>
        <smokingAllowed>false</smokingAllowed>
        <livingRoom>true</livingRoom>
        <comunityOptions>
            <Supermarket>true</Supermarket>
           <CoffeShop>true</CoffeShop>
        </comunityOptions>
        <transportOptions>
            <BUS>true</BUS>
            <subway_Metro>false</subway_Metro>
            <train>true</train>
        </transportOptions>
        <furniture>true</furniture>
        <deposit>100</deposit>
        <price>200</price>
        <availability>
            <from>2007-01-01</from>
            <to>2007-12-01</to>
        </availability>
        <duration>6</duration>
        <others></others>
        <comments>A casa é muita gira.</comments>
        <picture></picture>
    </house>
</houses>
